{
  "$schema": "https://json-schema.org/draft/2020-12/schema",
  "type": "object",
  "properties": {
    "id": {
      "type": "string"
    },
    "lastEvaluationHash": {
      "type": "string"
    },
    "changedSinceLastEvaluation": {
      "type": "boolean"
    },
    "info": {
      "type": "object",
      "properties": {
        "name": {
          "type": "string"
        },
        "description": {
          "type": "string"
        },
        "swVersion": {
          "type": "string"
        },
        "dataFormatVersion": {
          "type": "string",
          "const": "21"
        },
        "version": {
          "type": "number"
        },
        "lastModified": {
          "type": "string"
        },
        "createdAt": {
          "type": "string"
        },
        "extras": {
          "type": "object",
          "propertyNames": {
            "type": "string"
          },
          "additionalProperties": {}
        }
      },
      "required": [
        "name",
        "description",
        "swVersion",
        "dataFormatVersion",
        "version",
        "lastModified",
        "createdAt",
        "extras"
      ],
      "additionalProperties": false
    },
    "extras": {
      "type": "object",
      "propertyNames": {
        "type": "string"
      },
      "additionalProperties": {}
    },
    "categoricalVariables": {
      "type": "array",
      "items": {
        "type": "object",
        "properties": {
          "name": {
            "type": "string"
          },
          "description": {
            "type": "string"
          },
          "options": {
            "type": "array",
            "items": {
              "type": "string"
            }
          },
          "enabled": {
            "type": "boolean"
          }
        },
        "required": [
          "name",
          "description",
          "options",
          "enabled"
        ],
        "additionalProperties": false
      }
    },
    "valueVariables": {
      "type": "array",
      "items": {
        "type": "object",
        "properties": {
          "type": {
            "anyOf": [
              {
                "type": "string",
                "const": "discrete"
              },
              {
                "type": "string",
                "const": "continuous"
              }
            ]
          },
          "name": {
            "type": "string"
          },
          "description": {
            "type": "string"
          },
          "min": {
            "type": "number"
          },
          "max": {
            "type": "number"
          },
          "enabled": {
            "type": "boolean"
          }
        },
        "required": [
          "type",
          "name",
          "description",
          "min",
          "max",
          "enabled"
        ],
        "additionalProperties": false
      }
    },
    "scoreVariables": {
      "type": "array",
      "items": {
        "type": "object",
        "properties": {
          "name": {
            "anyOf": [
              {
                "type": "string",
                "const": "quality"
              },
              {
                "type": "string",
                "const": "cost"
              }
            ]
          },
          "label": {
            "type": "string"
          },
          "description": {
            "type": "string"
          },
          "enabled": {
            "type": "boolean"
          },
          "scoreFunction": {
            "type": "object",
            "properties": {
              "expression": {
                "type": "string"
              },
              "variables": {
                "type": "array",
                "items": {
                  "type": "object",
                  "properties": {
                    "name": {
                      "type": "string"
                    },
                    "symbol": {
                      "type": "string"
                    },
                    "source": {
                      "type": "string",
                      "enum": [
                        "response",
                        "factor"
                      ]
                    },
                    "factorName": {
                      "type": "string"
                    }
                  },
                  "required": [
                    "name",
                    "symbol",
                    "source"
                  ],
                  "additionalProperties": false
                }
              }
            },
            "required": [
              "expression",
              "variables"
            ],
            "additionalProperties": false
          }
        },
        "required": [
          "name",
          "label",
          "description",
          "enabled"
        ],
        "additionalProperties": false
      }
    },
    "constraints": {
      "type": "array",
      "items": {
        "type": "object",
        "properties": {
          "type": {
            "type": "string",
            "const": "sum"
          },
          "value": {
            "type": "number"
          },
          "dimensions": {
            "type": "array",
            "items": {
              "type": "string"
            }
          }
        },
        "required": [
          "type",
          "value",
          "dimensions"
        ],
        "additionalProperties": false
      }
    },
    "optimizerConfig": {
      "type": "object",
      "properties": {
        "baseEstimator": {
          "type": "string"
        },
        "acqFunc": {
          "type": "string"
        },
        "initialPoints": {
          "type": "number"
        },
        "kappa": {
          "type": "number"
        },
        "xi": {
          "type": "number"
        }
      },
      "required": [
        "baseEstimator",
        "acqFunc",
        "initialPoints",
        "kappa",
        "xi"
      ],
      "additionalProperties": false
    },
    "results": {
      "type": "object",
      "properties": {
        "id": {
          "type": "string"
        },
        "plots": {
          "type": "array",
          "items": {
            "type": "object",
            "properties": {
              "id": {
                "type": "string"
              },
              "plot": {
                "type": "string"
              }
            },
            "required": [
              "id",
              "plot"
            ],
            "additionalProperties": false
          }
        },
        "next": {
          "type": "array",
          "items": {
            "type": "array",
            "items": {
              "anyOf": [
                {
                  "type": "number"
                },
                {
                  "type": "string"
                }
              ]
            }
          }
        },
        "pickled": {
          "type": "string"
        },
        "expectedMinimum": {
          "type": "array",
          "items": {
            "anyOf": [
              {
                "type": "array",
                "items": {
                  "anyOf": [
                    {
                      "type": "number"
                    },
                    {
                      "type": "string"
                    }
                  ]
                }
              },
              {
                "type": "number"
              }
            ]
          }
        },
        "extras": {
          "type": "object",
          "propertyNames": {
            "type": "string"
          },
          "additionalProperties": {}
        }
      },
      "required": [
        "id",
        "plots",
        "next",
        "pickled",
        "expectedMinimum",
        "extras"
      ],
      "additionalProperties": false
    },
    "dataPoints": {
      "type": "array",
      "items": {
        "type": "object",
        "properties": {
          "meta": {
            "type": "object",
            "properties": {
              "id": {
                "type": "number"
              },
              "enabled": {
                "type": "boolean"
              },
              "valid": {
                "type": "boolean"
              },
              "description": {
                "type": "string"
              }
            },
            "required": [
              "id",
              "enabled",
              "valid"
            ],
            "additionalProperties": false
          },
          "data": {
            "type": "array",
            "items": {
              "oneOf": [
                {
                  "type": "object",
                  "properties": {
                    "type": {
                      "type": "string",
                      "const": "numeric"
                    },
                    "name": {
                      "type": "string"
                    },
                    "value": {
                      "type": "number"
                    }
                  },
                  "required": [
                    "type",
                    "name",
                    "value"
                  ],
                  "additionalProperties": false
                },
                {
                  "type": "object",
                  "properties": {
                    "type": {
                      "type": "string",
                      "const": "categorical"
                    },
                    "name": {
                      "type": "string"
                    },
                    "value": {
                      "type": "string"
                    }
                  },
                  "required": [
                    "type",
                    "name",
                    "value"
                  ],
                  "additionalProperties": false
                },
                {
                  "type": "object",
                  "properties": {
                    "type": {
                      "type": "string",
                      "const": "score"
                    },
                    "name": {
                      "type": "string"
                    },
                    "value": {
                      "type": "number"
                    }
                  },
                  "required": [
                    "type",
                    "name",
                    "value"
                  ],
                  "additionalProperties": false
                }
              ]
            }
          },
          "responses": {
            "type": "array",
            "items": {
              "type": "object",
              "properties": {
                "scoreName": {
                  "anyOf": [
                    {
                      "type": "string",
                      "const": "quality"
                    },
                    {
                      "type": "string",
                      "const": "cost"
                    }
                  ]
                },
                "useFunction": {
                  "type": "boolean"
                },
                "values": {
                  "type": "array",
                  "items": {
                    "type": "object",
                    "properties": {
                      "symbol": {
                        "type": "string"
                      },
                      "value": {
                        "type": "number"
                      }
                    },
                    "required": [
                      "symbol",
                      "value"
                    ],
                    "additionalProperties": false
                  }
                }
              },
              "required": [
                "scoreName",
                "useFunction",
                "values"
              ],
              "additionalProperties": false
            }
          }
        },
        "required": [
          "meta",
          "data"
        ],
        "additionalProperties": false
      }
    }
  },
  "required": [
    "id",
    "changedSinceLastEvaluation",
    "info",
    "extras",
    "categoricalVariables",
    "valueVariables",
    "scoreVariables",
    "constraints",
    "optimizerConfig",
    "results",
    "dataPoints"
  ],
  "additionalProperties": false
}