{
  "id": "1234",
  "changedSinceLastEvaluation": true,
  "lastEvaluationHash": "never-calculated",
  "info": {
    "dataFormatVersion": "21",
    "swVersion": "v1.2.0-16",
    "name": "Cake",
    "description": "Yummy",
    "version": 0,
    "extras": {},
    "lastModified": "",
    "createdAt": ""
  },
  "categoricalVariables": [
    {
      "name": "Icing",
      "description": "Sugary",
      "options": ["White", "Brown"],
      "enabled": true
    }
  ],
  "valueVariables": [
    {
      "name": "name1",
      "description": "desc1",
      "min": 10,
      "max": 100,
      "type": "discrete",
      "enabled": true
    },
    {
      "name": "name2",
      "description": "desc2",
      "min": 10.2,
      "max": 100.3,
      "type": "continuous",
      "enabled": true
    }
  ],
  "scoreVariables": [
    {
      "name": "quality",
      "label": "Quality (0-5)",
      "description": "",
      "enabled": true
    }
  ],
  "constraints": [
    {
      "type": "sum",
      "dimensions": [],
      "value": 0
    }
  ],
  "optimizerConfig": {
    "baseEstimator": "GP",
    "acqFunc": "EI",
    "initialPoints": 3,
    "kappa": 1.96,
    "xi": 0.01
  },
  "results": {
    "id": "",
    "next": [[]],
    "plots": [],
    "pickled": "",
    "expectedMinimum": [],
    "extras": {}
  },
  "dataPoints": [
    {
      "meta": {
        "enabled": true,
        "valid": true,
        "id": 1
      },
      "data": [
        {
          "type": "categorical",
          "name": "Icing",
          "value": "Brown"
        },
        {
          "type": "numeric",
          "name": "name1",
          "value": 10
        },
        {
          "type": "numeric",
          "name": "name2",
          "value": 10.2
        },
        {
          "type": "score",
          "name": "quality",
          "value": 0.5
        }
      ]
    }
  ],
  "extras": {
    "experimentSuggestionCount": 1
  }
}
